{
  "schema_version": "anomaly-detection/1.0",
  "detection_id": "08be2988c4323194bbeb8a29800e1b9a9d852216536bcfaac35474f124f6ed4a",
  "detector_id": "http-behavior",
  "environment": "local-lab",
  "data_origin": {
    "kind": "SERVICE_EVENTS",
    "dataset_id": null
  },
  "target_type": "SUBJECT",
  "target_key": {
    "key": "fx-subject-0006",
    "key_version": "fixture-v1"
  },
  "window": {
    "start": "2026-09-26T10:00:00Z",
    "end": "2026-09-26T10:05:00Z"
  },
  "event_ref": null,
  "feature_version": "http-feat-2",
  "model_version": "http-if-2026.09.26",
  "threshold_version": "http-thr-1",
  "input_hash": "sha256:b6868260571276b5c9c9421a4fa2c9170e608328cff954f07ed123376afe351f",
  "cutoff": "2026-09-26T10:06:00Z",
  "status": "FEATURE_MISMATCH",
  "status_reason": "FEATURE_VERSION_MISMATCH",
  "anomaly_score": null,
  "threshold": 0.62,
  "threshold_operator": "GT",
  "is_anomaly": null,
  "evidence": [],
  "detected_at": "2026-09-26T10:06:05Z"
}
