{
  "schema_version": "anomaly-detection/1.0",
  "detection_id": "b25a35c61b191d3bf51157b07c99484de010033824b2dd2fd582b26d0a892730",
  "detector_id": "http-behavior",
  "environment": "local-lab",
  "data_origin": {
    "kind": "SERVICE_EVENTS",
    "dataset_id": null
  },
  "target_type": "SUBJECT",
  "target_key": {
    "key": "fx-subject-0002",
    "key_version": "fixture-v1"
  },
  "window": {
    "start": "2026-09-26T10:00:00Z",
    "end": "2026-09-26T10:05:00Z"
  },
  "event_ref": null,
  "feature_version": "http-feat-1",
  "model_version": "http-if-2026.09.26",
  "threshold_version": "http-thr-1",
  "input_hash": "sha256:c6f5ab3096c79111c807d43a466f1867128a2e7d7e08b4599c2ccb8b8e54ef36",
  "cutoff": "2026-09-26T10:06:00Z",
  "status": "EVALUATED",
  "status_reason": "NONE",
  "anomaly_score": 0.91,
  "threshold": 0.62,
  "threshold_operator": "GT",
  "is_anomaly": true,
  "evidence": [
    {
      "feature": "sensitive_read_count",
      "unit": "COUNT",
      "observed_value": 120,
      "reference_statistic": "P95",
      "reference_value": 9,
      "reference_population": "TARGET_HISTORY"
    },
    {
      "feature": "response_body_bytes_sum",
      "unit": "BYTES",
      "observed_value": 7340032,
      "reference_statistic": "P95",
      "reference_value": 262144,
      "reference_population": "TARGET_HISTORY"
    }
  ],
  "detected_at": "2026-09-26T10:06:05Z"
}
