{
  "schema_version": "anomaly-detection/1.0",
  "detection_id": "557614af36014508df61a1f51d50477daaea82f1a5fad4e0cb0fed657baab39e",
  "detector_id": "http-behavior",
  "environment": "local-lab",
  "data_origin": {
    "kind": "SERVICE_EVENTS",
    "dataset_id": null
  },
  "target_type": "SUBJECT",
  "target_key": {
    "key": "fx-subject-0005",
    "key_version": "fixture-v1"
  },
  "window": {
    "start": "2026-09-26T10:00:00Z",
    "end": "2026-09-26T10:05:00Z"
  },
  "event_ref": null,
  "feature_version": "http-feat-1",
  "model_version": "http-if-2026.09.26",
  "threshold_version": "http-thr-1",
  "input_hash": "sha256:4eec06240df5c34c30d10f0b7a747b59e070e8e199b4b916494a3019a3ab75b8",
  "cutoff": "2026-09-26T10:06:00Z",
  "status": "INCOMPLETE_WINDOW",
  "status_reason": "JOIN_MISSING",
  "anomaly_score": null,
  "threshold": 0.62,
  "threshold_operator": "GT",
  "is_anomaly": null,
  "evidence": [],
  "detected_at": "2026-09-26T10:06:05Z"
}
