{
  "schema_version": "anomaly-detection/1.0",
  "detection_id": "fe00b22b4aa29888598a26b870af49d772241f82e1518e3136723cfa6ca1dacc",
  "detector_id": "http-behavior",
  "environment": "local-lab",
  "data_origin": {
    "kind": "SERVICE_EVENTS",
    "dataset_id": null
  },
  "target_type": "SUBJECT",
  "target_key": {
    "key": "fx-subject-0003",
    "key_version": "fixture-v1"
  },
  "window": {
    "start": "2026-09-26T10:00:00Z",
    "end": "2026-09-26T10:05:00Z"
  },
  "event_ref": null,
  "feature_version": "http-feat-1",
  "model_version": "http-if-2026.09.26",
  "threshold_version": "http-thr-1",
  "input_hash": "sha256:9b92dd7d648035bc14d3df98b6e6fabe28f831b28951b3e2593110839a8eabce",
  "cutoff": "2026-09-26T10:06:00Z",
  "status": "MODEL_UNAVAILABLE",
  "status_reason": "ARTIFACT_CHECKSUM_MISMATCH",
  "anomaly_score": null,
  "threshold": null,
  "threshold_operator": null,
  "is_anomaly": null,
  "evidence": [],
  "detected_at": "2026-09-26T10:06:05Z"
}
