{
  "schema_version": "anomaly-detection/1.0",
  "detection_id": "ab9085d719b1dea4662104161212b8cc6233ce383a380746e246fef0343aaa2d",
  "detector_id": "http-behavior",
  "environment": "local-lab",
  "data_origin": {
    "kind": "SERVICE_EVENTS",
    "dataset_id": null
  },
  "target_type": "SUBJECT",
  "target_key": {
    "key": "fx-subject-0004",
    "key_version": "fixture-v1"
  },
  "window": {
    "start": "2026-09-26T10:00:00Z",
    "end": "2026-09-26T10:05:00Z"
  },
  "event_ref": null,
  "feature_version": "http-feat-1",
  "model_version": "http-if-2026.09.26",
  "threshold_version": "http-thr-1",
  "input_hash": "sha256:211061ed55044b9d21d12a46cddb475ab9f0a9be8165b00d437ccfd94fdc71de",
  "cutoff": "2026-09-26T10:06:00Z",
  "status": "INSUFFICIENT_DATA",
  "status_reason": "BELOW_MIN_EVENTS",
  "anomaly_score": null,
  "threshold": 0.62,
  "threshold_operator": "GT",
  "is_anomaly": null,
  "evidence": [],
  "detected_at": "2026-09-26T10:06:05Z"
}
